{
  "canonical_symbol": "CANONICAL_XYZ",
  "broker_symbol": null,
  "broker_server": null,
  "asset_class": null,
  "base_currency": null,
  "quote_currency": null,
  "profit_currency": null,
  "contract_size": null,
  "tick_size": null,
  "tick_value": null,
  "digits": null,
  "volume_min": null,
  "volume_max": null,
  "volume_step": null,
  "stops_level_points": null,
  "freeze_level_points": null,
  "margin_mode": null,
  "sessions": [],
  "timezone": null,
  "spread_guard_points": null,
  "setup_whitelist": [],
  "timeframe_whitelist": [],
  "resolution_status": "UNRESOLVED",
  "source_version": "fixture-only"
}
